{
  "newsAndDisinfo.pageNavigation": {
    "trackedVisitsByCategory": [
      {
        "visitTrimmedUrl": "www.washingtonpost.com",
        "sourceTrimmedUrlFromReferrer": "t.co",
        "sourceTrimmedUrlFromTransitions": "t.co",
        "dayOfWeek": 5,
        "timeOfDay": 20,
        "classifierResults": {
          "covid-page-classifier": 2,
          "pol-page-classifier": 2
        },
        "categoryVisitsCount": 2,
        "categoryAttention": 17750,
        "categoryScroll": 0.3523031465968598
      },
      {
        "visitTrimmedUrl": "www.bbc.com",
        "sourceTrimmedUrlFromReferrer": "www.washingtonpost.com",
        "sourceTrimmedUrlFromTransitions": "www.washingtonpost.com",
        "dayOfWeek": 5,
        "timeOfDay": 20,
        "classifierResults": {
          "covid-page-classifier": 2,
          "pol-page-classifier": 2
        },
        "categoryVisitsCount": 1,
        "categoryAttention": 55917,
        "categoryScroll": 0.5355242566510172
      }
    ],
    "untrackedVisitsCount": 20,
    "untrackedAttention": 141007
  },
  "newsAndDisinfo.socialMediaLinkSharing": {
    "linkSharesByPlatform": [
      {
        "platform": "facebook",
        "trackedSharesByCategory": [],
        "untrackedSharesCount": 0
      },
      {
        "platform": "twitter",
        "trackedSharesByCategory": [
          {
            "sharedTrimmedUrl": "www.washingtonpost.com",
            "visitSourceFromTransitions": "",
            "classifierResults": {},
            "shareAudience": "restricted",
            "dayOfWeek": 5,
            "timeOfDay": 20,
            "categorySharesCount": 2,
            "categoryVisitsInPageNavigationCount": 0,
            "categoryVisitAttention": 0,
            "categoryVisitsInHistoryCount": 0
          },
          {
            "sharedTrimmedUrl": "www.wsj.com",
            "visitSourceFromTransitions": "t.co",
            "classifierResults": {
              "covid-page-classifier": 2,
              "pol-page-classifier": 1
            },
            "shareAudience": "restricted",
            "dayOfWeek": 5,
            "timeOfDay": 20,
            "categorySharesCount": 1,
            "categoryVisitsInPageNavigationCount": 1,
            "categoryVisitAttention": 19436,
            "categoryVisitsInHistoryCount": 1
          }
        ],
        "untrackedSharesCount": 1
      },
      {
        "platform": "reddit",
        "trackedSharesByCategory": [],
        "untrackedSharesCount": 0
      }
    ]
  },
  "newsAndDisinfo.linkExposure": {
    "trackedExposuresByCategory": [
      {
        "exposureSourceTrimmedUrl": "www.google.com",
        "exposureDestinationTrimmedUrl": "www.npr.org",
        "dayOfWeek": 5,
        "timeOfDay": 20,
        "categoryExposuresCount": 6
      },
      {
        "exposureSourceTrimmedUrl": "www.google.com",
        "exposureDestinationTrimmedUrl": "other",
        "dayOfWeek": 5,
        "timeOfDay": 20,
        "categoryExposuresCount": 7
      },
      {
        "exposureSourceTrimmedUrl": "twitter.com",
        "exposureDestinationTrimmedUrl": "www.npr.org",
        "dayOfWeek": 5,
        "timeOfDay": 20,
        "categoryExposuresCount": 2
      }
    ]
  },
  "newsAndDisinfo.surveyId": "178b7466-8f09-48ad-b22a-9a02ef3e9b5b",
  "newsAndDisinfo.version": "2.0"
}
